{
  "$schema": "http://json-schema.org/draft-07/schema#",
  "title": "CI PR Triage Report",
  "description": "Pre-scan JSON report generated in CI/CD pipeline that triggers agent triage",
  "type": "object",
  "required": [
    "schema_version",
    "pr",
    "ci",
    "stack",
    "diff",
    "signals"
  ],
  "additionalProperties": true,
  "properties": {
    "schema_version": {
      "type": "integer",
      "const": 1,
      "description": "Schema version number (must be 1 for v1 reports)"
    },
    "pr": {
      "type": "object",
      "required": [
        "number",
        "title",
        "base",
        "head"
      ],
      "additionalProperties": true,
      "properties": {
        "number": {
          "type": "integer",
          "minimum": 1
        },
        "title": {
          "type": "string"
        },
        "base": {
          "type": "string"
        },
        "head": {
          "type": "string"
        },
        "target_kind": {
          "type": "string"
        },
        "issue_refs": {
          "type": "array",
          "items": {
            "type": "integer"
          }
        }
      }
    },
    "ci": {
      "type": "object",
      "required": [
        "status"
      ],
      "additionalProperties": true,
      "properties": {
        "status": {
          "type": "string",
          "enum": ["none", "failing", "pending", "passing"]
        },
        "failing_checks": {
          "type": "array",
          "items": {
            "type": "string"
          }
        }
      }
    },
    "stack": {
      "type": "object",
      "properties": {
        "language": {
          "type": ["string", "null"]
        },
        "framework": {
          "type": ["string", "null"]
        },
        "orm": {
          "type": ["string", "null"]
        },
        "package_manager": {
          "type": ["string", "null"]
        },
        "linter": {
          "type": ["string", "null"]
        },
        "runtime": {
          "type": ["string", "null"]
        }
      },
      "additionalProperties": true
    },
    "diff": {
      "type": "object",
      "properties": {
        "files_changed": {
          "type": "integer",
          "minimum": 0
        },
        "insertions": {
          "type": "integer",
          "minimum": 0
        },
        "additions": {
          "type": "integer",
          "minimum": 0
        },
        "deletions": {
          "type": "integer",
          "minimum": 0
        },
        "source_files": {
          "type": "integer",
          "minimum": 0
        },
        "generated_files": {
          "type": "integer",
          "minimum": 0
        },
        "source_insertions": {
          "type": "integer",
          "minimum": 0
        },
        "top_level_dirs": {
          "type": "array",
          "items": {
            "type": "string"
          }
        },
        "largest_file": {
          "type": ["object", "null"],
          "properties": {
            "path": {
              "type": "string"
            },
            "changed": {
              "type": "integer",
              "minimum": 0
            }
          },
          "additionalProperties": true
        },
        "summary": {
          "type": "string"
        }
      },
      "additionalProperties": true
    },
    "signals": {
      "type": "array",
      "items": {
        "type": "object",
        "required": [
          "id",
          "present"
        ],
        "additionalProperties": true,
        "properties": {
          "id": {
            "type": "string",
            "minLength": 1
          },
          "present": {
            "type": "boolean"
          },
          "evidence": {
            "type": "array",
            "items": {
              "type": ["object", "string"],
              "properties": {
                "file": {
                  "type": "string"
                },
                "line": {
                  "type": ["integer", "null"]
                },
                "detail": {
                  "type": "string"
                }
              },
              "additionalProperties": true
            }
          }
        }
      }
    },
    "notes": {
      "type": "array",
      "items": {
        "type": "string"
      }
    },
    "chunk": {
      "type": ["object", "null"],
      "properties": {
        "branch": {
          "type": "string"
        },
        "merged_prs": {
          "type": "array",
          "items": {
            "type": "object",
            "required": [
              "number"
            ],
            "properties": {
              "number": {
                "type": "integer",
                "minimum": 1
              },
              "title": {
                "type": "string"
              },
              "issue_refs": {
                "type": "array",
                "items": {
                  "type": "integer"
                }
              },
              "needs_owner_review": {
                "type": "boolean"
              }
            },
            "additionalProperties": true
          }
        }
      },
      "additionalProperties": true
    }
  }
}
