{
  "chunk": null,
  "ci": {
    "failing_checks": [],
    "status": "none"
  },
  "diff": {
    "deletions": 0,
    "files_changed": 1,
    "generated_files": 0,
    "insertions": 2,
    "largest_file": {
      "changed": 2,
      "path": ".github/workflows/ci.yml"
    },
    "source_files": 1,
    "source_insertions": 2,
    "top_level_dirs": [
      ".github"
    ]
  },
  "notes": [],
  "pr": {
    "base": "chunk/scanner-hardening",
    "head": "feat/update-ci",
    "issue_refs": [],
    "number": 62,
    "target_kind": "implementation",
    "title": "Update CI workflow"
  },
  "schema_version": 1,
  "signals": [
    {
      "evidence": [],
      "id": "migration_sql_added",
      "present": false
    },
    {
      "evidence": [],
      "id": "migration_history_rewritten",
      "present": false
    },
    {
      "evidence": [],
      "id": "schema_changed_without_migration",
      "present": false
    },
    {
      "evidence": [],
      "id": "dependency_manifest_changed",
      "present": false
    },
    {
      "evidence": [],
      "id": "install_execution_allowed",
      "present": false
    },
    {
      "evidence": [],
      "id": "test_files_deleted",
      "present": false
    },
    {
      "evidence": [],
      "id": "tests_skipped_added",
      "present": false
    },
    {
      "evidence": [],
      "id": "safeguard_config_changed",
      "present": false
    },
    {
      "evidence": [],
      "id": "suppressions_added",
      "present": false
    },
    {
      "evidence": [
        {
          "detail": "git status M",
          "file": ".github/workflows/ci.yml",
          "line": null
        },
        {
          "detail": "+ permissions:",
          "file": ".github/workflows/ci.yml",
          "line": 3
        }
      ],
      "id": "workflow_changed",
      "present": true
    },
    {
      "evidence": [],
      "id": "stack_choice_changed",
      "present": false
    }
  ],
  "stack": {
    "framework": null,
    "linter": null,
    "orm": null,
    "package_manager": null
  }
}
