{
  "chunk": null,
  "ci": {
    "failing_checks": [],
    "status": "none"
  },
  "diff": {
    "deletions": 0,
    "files_changed": 2,
    "generated_files": 1,
    "insertions": 4,
    "largest_file": {
      "changed": 3,
      "path": ".gitmodules"
    },
    "source_files": 1,
    "source_insertions": 3,
    "top_level_dirs": [
      ".",
      "vendor"
    ]
  },
  "notes": [],
  "pr": {
    "base": "chunk/scanner-hardening",
    "head": "feat/add-submodule",
    "issue_refs": [],
    "number": 95,
    "target_kind": "implementation",
    "title": "Add vendor submodule"
  },
  "schema_version": 1,
  "signals": [
    {
      "evidence": [],
      "id": "migration_sql_added",
      "present": false
    },
    {
      "evidence": [],
      "id": "migration_history_rewritten",
      "present": false
    },
    {
      "evidence": [],
      "id": "schema_changed_without_migration",
      "present": false
    },
    {
      "evidence": [],
      "id": "dependency_manifest_changed",
      "present": false
    },
    {
      "evidence": [],
      "id": "install_execution_allowed",
      "present": false
    },
    {
      "evidence": [],
      "id": "test_files_deleted",
      "present": false
    },
    {
      "evidence": [],
      "id": "tests_skipped_added",
      "present": false
    },
    {
      "evidence": [],
      "id": "safeguard_config_changed",
      "present": false
    },
    {
      "evidence": [],
      "id": "suppressions_added",
      "present": false
    },
    {
      "evidence": [],
      "id": "workflow_changed",
      "present": false
    },
    {
      "evidence": [],
      "id": "stack_choice_changed",
      "present": false
    }
  ],
  "stack": {
    "framework": null,
    "linter": null,
    "orm": null,
    "package_manager": null
  }
}
