{
  "chunk": null,
  "ci": {
    "failing_checks": [],
    "status": "none"
  },
  "diff": {
    "deletions": 1,
    "files_changed": 1,
    "generated_files": 0,
    "insertions": 1,
    "largest_file": {
      "changed": 2,
      "path": "go.mod"
    },
    "source_files": 1,
    "source_insertions": 1,
    "top_level_dirs": [
      "."
    ]
  },
  "notes": [],
  "pr": {
    "base": "chunk/scanner-hardening",
    "head": "feat/bump-go-version",
    "issue_refs": [],
    "number": 64,
    "target_kind": "implementation",
    "title": "Bump Go version"
  },
  "schema_version": 1,
  "signals": [
    {
      "evidence": [],
      "id": "migration_sql_added",
      "present": false
    },
    {
      "evidence": [],
      "id": "migration_history_rewritten",
      "present": false
    },
    {
      "evidence": [],
      "id": "schema_changed_without_migration",
      "present": false
    },
    {
      "evidence": [
        {
          "detail": "- go 1.24",
          "file": "go.mod",
          "line": 3
        }
      ],
      "id": "dependency_manifest_changed",
      "present": true
    },
    {
      "evidence": [],
      "id": "install_execution_allowed",
      "present": false
    },
    {
      "evidence": [],
      "id": "test_files_deleted",
      "present": false
    },
    {
      "evidence": [],
      "id": "tests_skipped_added",
      "present": false
    },
    {
      "evidence": [],
      "id": "safeguard_config_changed",
      "present": false
    },
    {
      "evidence": [],
      "id": "suppressions_added",
      "present": false
    },
    {
      "evidence": [],
      "id": "workflow_changed",
      "present": false
    },
    {
      "evidence": [
        {
          "detail": "go_version: 1.24 -> 1.25",
          "file": "go.mod",
          "line": null
        }
      ],
      "id": "stack_choice_changed",
      "present": true
    }
  ],
  "stack": {
    "framework": null,
    "linter": null,
    "orm": null,
    "package_manager": "go"
  }
}
