{
  "chunk": null,
  "ci": {
    "failing_checks": [],
    "status": "none"
  },
  "diff": {
    "deletions": 0,
    "files_changed": 1,
    "generated_files": 0,
    "insertions": 1,
    "largest_file": {
      "changed": 1,
      "path": "internal/db/migrations/0002_add_table.sql"
    },
    "source_files": 1,
    "source_insertions": 1,
    "top_level_dirs": [
      "internal"
    ]
  },
  "notes": [],
  "pr": {
    "base": "chunk/scanner-hardening",
    "head": "feat/add-migration",
    "issue_refs": [],
    "number": 43,
    "target_kind": "implementation",
    "title": "Add a new migration"
  },
  "schema_version": 1,
  "signals": [
    {
      "evidence": [
        {
          "detail": "CREATE TABLE widgets (id INTEGER PRIMARY KEY, name TEXT);",
          "file": "internal/db/migrations/0002_add_table.sql",
          "line": 1
        }
      ],
      "id": "migration_sql_added",
      "present": true
    },
    {
      "evidence": [],
      "id": "migration_history_rewritten",
      "present": false
    },
    {
      "evidence": [],
      "id": "schema_changed_without_migration",
      "present": false
    },
    {
      "evidence": [],
      "id": "dependency_manifest_changed",
      "present": false
    },
    {
      "evidence": [],
      "id": "install_execution_allowed",
      "present": false
    },
    {
      "evidence": [],
      "id": "test_files_deleted",
      "present": false
    },
    {
      "evidence": [],
      "id": "tests_skipped_added",
      "present": false
    },
    {
      "evidence": [],
      "id": "safeguard_config_changed",
      "present": false
    },
    {
      "evidence": [],
      "id": "suppressions_added",
      "present": false
    },
    {
      "evidence": [],
      "id": "workflow_changed",
      "present": false
    },
    {
      "evidence": [],
      "id": "stack_choice_changed",
      "present": false
    }
  ],
  "stack": {
    "framework": null,
    "linter": null,
    "orm": null,
    "package_manager": null
  }
}
